{
  "schema_version": 1,
  "company": "TEST Company",
  "title": "TEST Role",
  "source_url": "https://example.test/jobs/test-role",
  "requirements": {"required": ["TEST requirement"], "nice_to_have": []},
  "documents": {"required": ["cv"], "optional": []},
  "form_questions": [],
  "unknowns": []
}
